{
  "schemaVersion": 1,
  "title": "Example Torino Spring Open",
  "startDate": "2026-04-18",
  "endDate": "2026-04-20",
  "country": "Italy",
  "city": "Torino",
  "venue": "Example Chess Club",
  "timeControl": "standard",
  "ratingType": "FIDE",
  "sourceName": "Example Federation Calendar",
  "sourceUrl": "https://example.org/tournaments/torino-spring-open-2026",
  "websiteUrl": "https://example.org/tournaments/torino-spring-open-2026",
  "registrationUrl": "https://example.org/tournaments/torino-spring-open-2026/register",
  "resultsUrl": "https://example.org/tournaments/torino-spring-open-2026/results",
  "regulationsUrl": "https://example.org/tournaments/torino-spring-open-2026/regulations",
  "externalLinks": [
    {
      "label": "Organizer page",
      "url": "https://example-club.org/torino-spring-open"
    }
  ],
  "originalId": "example-2026-torino-spring-open",
  "confidence": 0.92,
  "qualityFlags": [],
  "evidenceRefs": [
    {
      "refId": "ev-001",
      "path": "runs/2026-07-03/1800-example-source/evidence-001.md",
      "sourceUrl": "https://example.org/tournaments/torino-spring-open-2026",
      "capturedAt": "2026-07-03T16:00:00Z",
      "excerpt": "Example Torino Spring Open listed for April 18-20, 2026 in Torino.",
      "notes": "Example data for schema validation only."
    }
  ],
  "dedupeKey": "italy|torino|2026-04-18|example-torino-spring-open",
  "lastCheckedAt": "2026-07-03T16:00:00Z",
  "approvedAt": "2026-07-03T16:30:00Z",
  "approvedBy": "codex-review",
  "publishStatus": "ready"
}

